{
  "schema_version": "1.0.0",
  "manifest_id": "30000000-0000-4000-8000-000000000002",
  "manifest_sequence": 1,
  "agent_id": "20000000-0000-4000-8000-000000000005",
  "agent_version": "0.1.0",
  "platform": "windows",
  "platform_version": "11-24H2",
  "protocol_version": "1.0.0",
  "capability_catalog_version": "1.0.0",
  "generated_at": "2026-07-12T12:00:00Z",
  "capabilities": [
    {"id":"wifi.connection.read","version":"1.0.0","technical_support":{"status":"supported","reason":null},"implementation_status":{"status":"implemented","reason":null},"permission_requirement":{"status":"none","permissions":[],"reason":null},"user_interaction":{"status":"none","reason":null},"background_execution":{"status":"continuous","reason":null},"provider":{"status":"available","implementations":[{"provider_id":"windows-wifi","provider_version":"1.0.0","method":"wlan_api"}],"reason":null},"limitations":{"status":"known","max_concurrency":1,"reason":null}},
    {"id":"wifi.scan","version":"1.0.0","technical_support":{"status":"conditional","reason":{"code":"permission_missing"}},"implementation_status":{"status":"planned","reason":{"code":"not_implemented"}},"permission_requirement":{"status":"conditional","permissions":["wifi.scan"],"reason":{"code":"permission_missing"}},"user_interaction":{"status":"none","reason":null},"background_execution":{"status":"bounded","reason":null},"provider":{"status":"unavailable","implementations":[],"reason":{"code":"provider_unavailable"}},"limitations":{"status":"known","max_concurrency":1,"reason":null}},
    {"id":"wifi.rssi.read","version":"1.0.0","technical_support":{"status":"conditional","reason":null},"implementation_status":{"status":"planned","reason":{"code":"not_implemented"}},"permission_requirement":{"status":"none","permissions":[],"reason":null},"user_interaction":{"status":"none","reason":null},"background_execution":{"status":"continuous","reason":null},"provider":{"status":"unavailable","implementations":[],"reason":{"code":"provider_unavailable"}},"limitations":{"status":"unknown","reason":{"code":"unknown"}}},
    {"id":"network.icmp.ping","version":"1.0.0","technical_support":{"status":"conditional","reason":null},"implementation_status":{"status":"planned","reason":{"code":"not_implemented"}},"permission_requirement":{"status":"conditional","permissions":["network.icmp"],"reason":null},"user_interaction":{"status":"none","reason":null},"background_execution":{"status":"continuous","reason":null},"provider":{"status":"unavailable","implementations":[],"reason":{"code":"provider_unavailable"}},"limitations":{"status":"unknown","reason":{"code":"unknown"}}},
    {"id":"network.tcp.probe","version":"1.0.0","technical_support":{"status":"supported","reason":null},"implementation_status":{"status":"planned","reason":{"code":"not_implemented"}},"permission_requirement":{"status":"none","permissions":[],"reason":null},"user_interaction":{"status":"none","reason":null},"background_execution":{"status":"continuous","reason":null},"provider":{"status":"available","implementations":[{"provider_id":"native-tcp","provider_version":"1.0.0","method":"connect"}],"reason":null},"limitations":{"status":"known","max_duration_seconds":300,"max_concurrency":4,"reason":null}},
    {"id":"network.http.probe","version":"1.0.0","technical_support":{"status":"supported","reason":null},"implementation_status":{"status":"implemented","reason":null},"permission_requirement":{"status":"none","permissions":[],"reason":null},"user_interaction":{"status":"none","reason":null},"background_execution":{"status":"continuous","reason":null},"provider":{"status":"available","implementations":[{"provider_id":"native-http","provider_version":"1.0.0","method":"http_get"}],"reason":null},"limitations":{"status":"known","max_duration_seconds":300,"max_concurrency":4,"reason":null}},
    {"id":"traffic.tcp.throughput","version":"1.0.0","technical_support":{"status":"supported","reason":null},"implementation_status":{"status":"planned","reason":{"code":"not_implemented"}},"permission_requirement":{"status":"none","permissions":[],"reason":null},"user_interaction":{"status":"none","reason":null},"background_execution":{"status":"bounded","reason":null},"provider":{"status":"available","implementations":[{"provider_id":"traffic-provider-iperf3","provider_version":"3.18.0","method":"tcp"}],"reason":null},"limitations":{"status":"known","max_duration_seconds":3600,"max_concurrency":2,"max_streams":16,"reason":null}},
    {"id":"traffic.udp.throughput","version":"1.0.0","technical_support":{"status":"supported","reason":null},"implementation_status":{"status":"planned","reason":{"code":"not_implemented"}},"permission_requirement":{"status":"none","permissions":[],"reason":null},"user_interaction":{"status":"none","reason":null},"background_execution":{"status":"bounded","reason":null},"provider":{"status":"available","implementations":[{"provider_id":"traffic-provider-iperf3","provider_version":"3.18.0","method":"udp"}],"reason":null},"limitations":{"status":"known","max_duration_seconds":3600,"max_throughput_bps":10000000000,"max_concurrency":2,"max_streams":16,"reason":null}},
    {"id":"traffic.http.download","version":"1.0.0","technical_support":{"status":"supported","reason":null},"implementation_status":{"status":"planned","reason":{"code":"not_implemented"}},"permission_requirement":{"status":"none","permissions":[],"reason":null},"user_interaction":{"status":"none","reason":null},"background_execution":{"status":"bounded","reason":null},"provider":{"status":"available","implementations":[{"provider_id":"native-http","provider_version":"1.0.0","method":"download"}],"reason":null},"limitations":{"status":"known","max_duration_seconds":1800,"max_concurrency":4,"reason":null}},
    {"id":"traffic.http.upload","version":"1.0.0","technical_support":{"status":"supported","reason":null},"implementation_status":{"status":"planned","reason":{"code":"not_implemented"}},"permission_requirement":{"status":"none","permissions":[],"reason":null},"user_interaction":{"status":"none","reason":null},"background_execution":{"status":"bounded","reason":null},"provider":{"status":"available","implementations":[{"provider_id":"native-http","provider_version":"1.0.0","method":"upload"}],"reason":null},"limitations":{"status":"known","max_duration_seconds":1800,"max_payload_bytes":1073741824,"max_concurrency":4,"reason":null}},
    {"id":"traffic.latency_under_load","version":"1.0.0","technical_support":{"status":"conditional","reason":null},"implementation_status":{"status":"planned","reason":{"code":"not_implemented"}},"permission_requirement":{"status":"none","permissions":[],"reason":null},"user_interaction":{"status":"none","reason":null},"background_execution":{"status":"bounded","reason":null},"provider":{"status":"unavailable","implementations":[],"reason":{"code":"provider_unavailable"}},"limitations":{"status":"unknown","reason":{"code":"unknown"}}},
    {"id":"capture.ip","version":"1.0.0","technical_support":{"status":"conditional","reason":{"code":"permission_missing"}},"implementation_status":{"status":"not_implemented","reason":{"code":"not_implemented"}},"permission_requirement":{"status":"required","permissions":["packet.capture"],"reason":{"code":"permission_missing"}},"user_interaction":{"status":"conditional","reason":null},"background_execution":{"status":"bounded","reason":null},"provider":{"status":"unavailable","implementations":[],"reason":{"code":"provider_unavailable"}},"limitations":{"status":"unknown","reason":{"code":"unknown"}}},
    {"id":"capture.ieee80211.monitor","version":"1.0.0","technical_support":{"status":"unsupported","reason":{"code":"not_exposed_by_platform"}},"implementation_status":{"status":"excluded","reason":{"code":"not_applicable"}},"permission_requirement":{"status":"not_applicable","permissions":[],"reason":{"code":"not_applicable"}},"user_interaction":{"status":"not_applicable","reason":{"code":"not_applicable"}},"background_execution":{"status":"not_applicable","reason":{"code":"not_applicable"}},"provider":{"status":"not_applicable","implementations":[],"reason":{"code":"not_applicable"}},"limitations":{"status":"not_applicable","reason":{"code":"not_applicable"}}},
    {"id":"traffic.pcap.replay","version":"1.0.0","technical_support":{"status":"unsupported","reason":{"code":"not_applicable"}},"implementation_status":{"status":"excluded","reason":{"code":"not_applicable"}},"permission_requirement":{"status":"not_applicable","permissions":[],"reason":{"code":"not_applicable"}},"user_interaction":{"status":"not_applicable","reason":{"code":"not_applicable"}},"background_execution":{"status":"not_applicable","reason":{"code":"not_applicable"}},"provider":{"status":"not_applicable","implementations":[],"reason":{"code":"not_applicable"}},"limitations":{"status":"not_applicable","reason":{"code":"not_applicable"}}},
    {"id":"execution.background.continuous","version":"1.0.0","technical_support":{"status":"supported","reason":null},"implementation_status":{"status":"planned","reason":{"code":"not_implemented"}},"permission_requirement":{"status":"required","permissions":["service.install"],"reason":null},"user_interaction":{"status":"conditional","reason":null},"background_execution":{"status":"continuous","reason":null},"provider":{"status":"available","implementations":[{"provider_id":"windows-service","provider_version":"1.0.0","method":"service"}],"reason":null},"limitations":{"status":"known","max_concurrency":1,"reason":null}}
  ]
}
